{
  "blocks": [
    {
      "first_cycle": 1454,
      "hits": 1,
      "last_cycle": 1454,
      "mode": {
        "emulation": true,
        "m8": true,
        "x8": true
      },
      "pc": 35828,
      "processor": "sa1"
    },
    {
      "first_cycle": 1456,
      "hits": 1,
      "last_cycle": 1456,
      "mode": {
        "emulation": true,
        "m8": true,
        "x8": true
      },
      "pc": 35829,
      "processor": "sa1"
    },
    {
      "first_cycle": 1459,
      "hits": 1,
      "last_cycle": 1459,
      "mode": {
        "emulation": true,
        "m8": true,
        "x8": true
      },
      "pc": 35830,
      "processor": "sa1"
    },
    {
      "first_cycle": 1462,
      "hits": 1,
      "last_cycle": 1462,
      "mode": {
        "emulation": false,
        "m8": true,
        "x8": true
      },
      "pc": 35831,
      "processor": "sa1"
    },
    {
      "first_cycle": 1467,
      "hits": 1,
      "last_cycle": 1467,
      "mode": {
        "emulation": false,
        "m8": true,
        "x8": true
      },
      "pc": 35833,
      "processor": "sa1"
    },
    {
      "first_cycle": 1475,
      "hits": 1,
      "last_cycle": 1475,
      "mode": {
        "emulation": false,
        "m8": true,
        "x8": true
      },
      "pc": 35836,
      "processor": "sa1"
    },
    {
      "first_cycle": 1482,
      "hits": 1,
      "last_cycle": 1482,
      "mode": {
        "emulation": false,
        "m8": true,
        "x8": true
      },
      "pc": 35839,
      "processor": "sa1"
    },
    {
      "first_cycle": 1484,
      "hits": 1,
      "last_cycle": 1484,
      "mode": {
        "emulation": false,
        "m8": true,
        "x8": true
      },
      "pc": 35841,
      "processor": "sa1"
    },
    {
      "first_cycle": 1488,
      "hits": 1,
      "last_cycle": 1488,
      "mode": {
        "emulation": false,
        "m8": true,
        "x8": true
      },
      "pc": 35844,
      "processor": "sa1"
    },
    {
      "first_cycle": 1495,
      "hits": 1,
      "last_cycle": 1495,
      "mode": {
        "emulation": false,
        "m8": true,
        "x8": true
      },
      "pc": 35847,
      "processor": "sa1"
    },
    {
      "first_cycle": 1498,
      "hits": 1,
      "last_cycle": 1498,
      "mode": {
        "emulation": false,
        "m8": true,
        "x8": true
      },
      "pc": 35849,
      "processor": "sa1"
    },
    {
      "first_cycle": 1506,
      "hits": 1,
      "last_cycle": 1506,
      "mode": {
        "emulation": false,
        "m8": true,
        "x8": true
      },
      "pc": 35852,
      "processor": "sa1"
    },
    {
      "first_cycle": 1513,
      "hits": 1,
      "last_cycle": 1513,
      "mode": {
        "emulation": false,
        "m8": true,
        "x8": true
      },
      "pc": 35855,
      "processor": "sa1"
    },
    {
      "first_cycle": 1520,
      "hits": 1,
      "last_cycle": 1520,
      "mode": {
        "emulation": false,
        "m8": true,
        "x8": true
      },
      "pc": 35858,
      "processor": "sa1"
    },
    {
      "first_cycle": 1527,
      "hits": 1,
      "last_cycle": 1527,
      "mode": {
        "emulation": false,
        "m8": true,
        "x8": true
      },
      "pc": 35861,
      "processor": "sa1"
    },
    {
      "first_cycle": 1532,
      "hits": 1,
      "last_cycle": 1532,
      "mode": {
        "emulation": false,
        "m8": false,
        "x8": false
      },
      "pc": 35863,
      "processor": "sa1"
    },
    {
      "first_cycle": 1538,
      "hits": 1,
      "last_cycle": 1538,
      "mode": {
        "emulation": false,
        "m8": false,
        "x8": false
      },
      "pc": 35866,
      "processor": "sa1"
    },
    {
      "first_cycle": 1544,
      "hits": 1,
      "last_cycle": 1544,
      "mode": {
        "emulation": false,
        "m8": false,
        "x8": false
      },
      "pc": 35869,
      "processor": "sa1"
    },
    {
      "first_cycle": 1550,
      "hits": 2047,
      "last_cycle": 22001,
      "mode": {
        "emulation": false,
        "m8": false,
        "x8": false
      },
      "pc": 35872,
      "processor": "sa1"
    },
    {
      "first_cycle": 22011,
      "hits": 1,
      "last_cycle": 22011,
      "mode": {
        "emulation": false,
        "m8": false,
        "x8": false
      },
      "pc": 35875,
      "processor": "sa1"
    },
    {
      "first_cycle": 22016,
      "hits": 1,
      "last_cycle": 22016,
      "mode": {
        "emulation": false,
        "m8": false,
        "x8": false
      },
      "pc": 35878,
      "processor": "sa1"
    },
    {
      "first_cycle": 22022,
      "hits": 1,
      "last_cycle": 22022,
      "mode": {
        "emulation": false,
        "m8": false,
        "x8": false
      },
      "pc": 35881,
      "processor": "sa1"
    },
    {
      "first_cycle": 22028,
      "hits": 2932,
      "last_cycle": 56021,
      "mode": {
        "emulation": false,
        "m8": false,
        "x8": false
      },
      "pc": 35884,
      "processor": "sa1"
    },
    {
      "first_cycle": 0,
      "hits": 1,
      "last_cycle": 0,
      "mode": {
        "emulation": true,
        "m8": true,
        "x8": true
      },
      "pc": 32772,
      "processor": "scpu"
    },
    {
      "first_cycle": 2,
      "hits": 1,
      "last_cycle": 2,
      "mode": {
        "emulation": true,
        "m8": true,
        "x8": true
      },
      "pc": 32773,
      "processor": "scpu"
    },
    {
      "first_cycle": 4,
      "hits": 1,
      "last_cycle": 4,
      "mode": {
        "emulation": true,
        "m8": true,
        "x8": true
      },
      "pc": 32774,
      "processor": "scpu"
    },
    {
      "first_cycle": 6,
      "hits": 1,
      "last_cycle": 6,
      "mode": {
        "emulation": false,
        "m8": true,
        "x8": true
      },
      "pc": 32775,
      "processor": "scpu"
    },
    {
      "first_cycle": 9,
      "hits": 1,
      "last_cycle": 9,
      "mode": {
        "emulation": false,
        "m8": true,
        "x8": true
      },
      "pc": 32777,
      "processor": "scpu"
    },
    {
      "first_cycle": 12,
      "hits": 1,
      "last_cycle": 12,
      "mode": {
        "emulation": false,
        "m8": true,
        "x8": false
      },
      "pc": 32779,
      "processor": "scpu"
    },
    {
      "first_cycle": 15,
      "hits": 1,
      "last_cycle": 15,
      "mode": {
        "emulation": false,
        "m8": true,
        "x8": false
      },
      "pc": 32782,
      "processor": "scpu"
    },
    {
      "first_cycle": 17,
      "hits": 1,
      "last_cycle": 17,
      "mode": {
        "emulation": false,
        "m8": true,
        "x8": false
      },
      "pc": 32783,
      "processor": "scpu"
    },
    {
      "first_cycle": 20,
      "hits": 1,
      "last_cycle": 20,
      "mode": {
        "emulation": false,
        "m8": true,
        "x8": false
      },
      "pc": 32784,
      "processor": "scpu"
    },
    {
      "first_cycle": 24,
      "hits": 1,
      "last_cycle": 24,
      "mode": {
        "emulation": false,
        "m8": true,
        "x8": false
      },
      "pc": 32785,
      "processor": "scpu"
    },
    {
      "first_cycle": 28,
      "hits": 1,
      "last_cycle": 28,
      "mode": {
        "emulation": false,
        "m8": true,
        "x8": false
      },
      "pc": 32788,
      "processor": "scpu"
    },
    {
      "first_cycle": 33,
      "hits": 1,
      "last_cycle": 33,
      "mode": {
        "emulation": false,
        "m8": true,
        "x8": false
      },
      "pc": 32791,
      "processor": "scpu"
    },
    {
      "first_cycle": 38,
      "hits": 1,
      "last_cycle": 38,
      "mode": {
        "emulation": false,
        "m8": true,
        "x8": false
      },
      "pc": 32792,
      "processor": "scpu"
    },
    {
      "first_cycle": 40,
      "hits": 1,
      "last_cycle": 40,
      "mode": {
        "emulation": false,
        "m8": true,
        "x8": false
      },
      "pc": 32794,
      "processor": "scpu"
    },
    {
      "first_cycle": 43,
      "hits": 1,
      "last_cycle": 43,
      "mode": {
        "emulation": false,
        "m8": true,
        "x8": false
      },
      "pc": 32796,
      "processor": "scpu"
    },
    {
      "first_cycle": 45,
      "hits": 1,
      "last_cycle": 45,
      "mode": {
        "emulation": false,
        "m8": true,
        "x8": false
      },
      "pc": 32798,
      "processor": "scpu"
    },
    {
      "first_cycle": 48,
      "hits": 1,
      "last_cycle": 48,
      "mode": {
        "emulation": false,
        "m8": true,
        "x8": false
      },
      "pc": 32800,
      "processor": "scpu"
    },
    {
      "first_cycle": 51,
      "hits": 1,
      "last_cycle": 51,
      "mode": {
        "emulation": false,
        "m8": true,
        "x8": false
      },
      "pc": 32802,
      "processor": "scpu"
    },
    {
      "first_cycle": 54,
      "hits": 1,
      "last_cycle": 54,
      "mode": {
        "emulation": false,
        "m8": true,
        "x8": false
      },
      "pc": 32804,
      "processor": "scpu"
    },
    {
      "first_cycle": 56,
      "hits": 1,
      "last_cycle": 56,
      "mode": {
        "emulation": false,
        "m8": true,
        "x8": false
      },
      "pc": 32806,
      "processor": "scpu"
    },
    {
      "first_cycle": 59,
      "hits": 1,
      "last_cycle": 59,
      "mode": {
        "emulation": false,
        "m8": true,
        "x8": false
      },
      "pc": 32808,
      "processor": "scpu"
    },
    {
      "first_cycle": 62,
      "hits": 1,
      "last_cycle": 62,
      "mode": {
        "emulation": false,
        "m8": true,
        "x8": false
      },
      "pc": 32810,
      "processor": "scpu"
    },
    {
      "first_cycle": 65,
      "hits": 1,
      "last_cycle": 65,
      "mode": {
        "emulation": false,
        "m8": true,
        "x8": false